[I 2026-07-14 12:49:19,440] A new study created in RDB with name: hard_bc_paul_trap
[I 2026-07-14 12:51:13,996] Trial 0 finished with value: 9.665583610534668 and parameters: {'sym_mode': 'prefactor', 'depth': 4, 'width': 84, 'activation': 'sin', 'n_fourier': 16, 'lr': 0.0011423254155608382, 'optimizer': 'adamw', 'scheduler': 'none', 'batch': 2048, 'center_frac': 0.4350060741234096, 'ff_sigma': 3.8260481417538514, 'weight_decay': 0.0002497328610406057}. Best is trial 0 with value: 9.665583610534668.
[I 2026-07-14 12:52:21,287] Trial 1 finished with value: 5029.3740234375 and parameters: {'sym_mode': 'prefactor', 'depth': 2, 'width': 100, 'activation': 'sin', 'n_fourier': 32, 'lr': 0.0013704648392849023, 'optimizer': 'adamw', 'scheduler': 'none', 'batch': 1024, 'center_frac': 0.21851597689967073, 'ff_sigma': 2.1330142261629947, 'weight_decay': 1.5159204611384704e-06}. Best is trial 0 with value: 9.665583610534668.
[I 2026-07-14 12:54:46,650] Trial 2 finished with value: 29.146892547607422 and parameters: {'sym_mode': 'prefactor', 'depth': 2, 'width': 40, 'activation': 'gelu', 'n_fourier': 16, 'lr': 0.00021019338091154426, 'optimizer': 'adam', 'scheduler': 'cosine', 'batch': 4096, 'center_frac': 0.0690914756743069, 'ff_sigma': 0.7524914449048727}. Best is trial 0 with value: 9.665583610534668.
[I 2026-07-14 12:57:43,660] Trial 3 finished with value: 88.10958862304688 and parameters: {'sym_mode': 'prefactor', 'depth': 2, 'width': 144, 'activation': 'sin', 'n_fourier': 0, 'lr': 0.00036780186337684095, 'optimizer': 'adamw', 'scheduler': 'none', 'batch': 4096, 'center_frac': 0.2833007271032876, 'weight_decay': 6.254152586876399e-06}. Best is trial 0 with value: 9.665583610534668.
[I 2026-07-14 13:31:12,336] Trial 4 finished with value: 0.19780831038951874 and parameters: {'sym_mode': 'reynolds', 'depth': 4, 'width': 169, 'activation': 'sin', 'n_fourier': 0, 'lr': 0.00010970213817508303, 'optimizer': 'adam', 'scheduler': 'cosine', 'batch': 2048, 'center_frac': 0.28807866720891845}. Best is trial 4 with value: 0.19780831038951874.
[I 2026-07-14 13:38:30,242] Trial 5 finished with value: 0.21057485044002533 and parameters: {'sym_mode': 'reynolds', 'depth': 2, 'width': 177, 'activation': 'sin', 'n_fourier': 64, 'lr': 0.0014539375242431556, 'optimizer': 'adam', 'scheduler': 'cosine', 'batch': 1024, 'center_frac': 0.3031966070639622, 'ff_sigma': 0.5203591427445313}. Best is trial 4 with value: 0.19780831038951874.
[I 2026-07-14 13:38:38,499] Trial 6 pruned. 
[I 2026-07-14 13:43:10,140] Trial 7 finished with value: 0.1976696401834488 and parameters: {'sym_mode': 'reynolds', 'depth': 5, 'width': 42, 'activation': 'gelu', 'n_fourier': 0, 'lr': 0.002482318741925866, 'optimizer': 'adamw', 'scheduler': 'none', 'batch': 1024, 'center_frac': 0.364995281212029, 'weight_decay': 3.2725706551202704e-06}. Best is trial 7 with value: 0.1976696401834488.
[I 2026-07-14 13:46:35,122] Trial 8 finished with value: 0.19722625613212585 and parameters: {'sym_mode': 'reynolds', 'depth': 2, 'width': 33, 'activation': 'tanh', 'n_fourier': 0, 'lr': 0.001749672649182914, 'optimizer': 'adam', 'scheduler': 'cosine', 'batch': 4096, 'center_frac': 0.15597249773980093}. Best is trial 8 with value: 0.19722625613212585.
[I 2026-07-14 13:50:54,918] Trial 9 pruned. 
[I 2026-07-14 14:13:35,997] Trial 10 finished with value: 0.19708627462387085 and parameters: {'sym_mode': 'reynolds', 'depth': 5, 'width': 62, 'activation': 'tanh', 'n_fourier': 0, 'lr': 0.009151793441266539, 'optimizer': 'adam', 'scheduler': 'cosine', 'batch': 4096, 'center_frac': 0.14071107606964692}. Best is trial 10 with value: 0.19708627462387085.
[I 2026-07-14 14:27:39,149] Trial 11 finished with value: 0.19749745726585388 and parameters: {'sym_mode': 'reynolds', 'depth': 5, 'width': 58, 'activation': 'tanh', 'n_fourier': 0, 'lr': 0.009542019933129002, 'optimizer': 'adam', 'scheduler': 'cosine', 'batch': 4096, 'center_frac': 0.15253121430442068}. Best is trial 10 with value: 0.19708627462387085.
[I 2026-07-14 14:33:51,619] Trial 12 finished with value: 0.19741635024547577 and parameters: {'sym_mode': 'reynolds', 'depth': 4, 'width': 32, 'activation': 'tanh', 'n_fourier': 0, 'lr': 0.00840939762618804, 'optimizer': 'adam', 'scheduler': 'cosine', 'batch': 4096, 'center_frac': 0.14323854890786702}. Best is trial 10 with value: 0.19708627462387085.
[I 2026-07-14 15:28:32,726] Trial 13 finished with value: 0.19744955003261566 and parameters: {'sym_mode': 'reynolds', 'depth': 3, 'width': 59, 'activation': 'tanh', 'n_fourier': 0, 'lr': 0.0041284343334974435, 'optimizer': 'adam', 'scheduler': 'cosine', 'batch': 4096, 'center_frac': 0.16040559023364476}. Best is trial 10 with value: 0.19708627462387085.
[I 2026-07-14 15:29:38,730] Trial 14 pruned. 
[I 2026-07-14 15:52:13,476] Trial 15 finished with value: 0.19743771851062775 and parameters: {'sym_mode': 'reynolds', 'depth': 5, 'width': 45, 'activation': 'tanh', 'n_fourier': 0, 'lr': 0.003817229529625629, 'optimizer': 'adam', 'scheduler': 'cosine', 'batch': 4096, 'center_frac': 0.017572076016118696}. Best is trial 10 with value: 0.19708627462387085.
[I 2026-07-14 16:17:31,593] Trial 16 finished with value: 0.17795267701148987 and parameters: {'sym_mode': 'reynolds', 'depth': 4, 'width': 35, 'activation': 'tanh', 'n_fourier': 32, 'lr': 0.005631868359964832, 'optimizer': 'adam', 'scheduler': 'cosine', 'batch': 4096, 'center_frac': 0.21187960431299013, 'ff_sigma': 1.3355148066365234}. Best is trial 16 with value: 0.17795267701148987.
[I 2026-07-14 16:52:01,831] Trial 17 finished with value: 0.18770210444927216 and parameters: {'sym_mode': 'reynolds', 'depth': 4, 'width': 76, 'activation': 'gelu', 'n_fourier': 32, 'lr': 0.0055591345652148, 'optimizer': 'adam', 'scheduler': 'cosine', 'batch': 2048, 'center_frac': 0.2370911021552829, 'ff_sigma': 1.297708607324914}. Best is trial 16 with value: 0.17795267701148987.
[I 2026-07-14 17:17:38,683] Trial 18 finished with value: 0.19071030616760254 and parameters: {'sym_mode': 'reynolds', 'depth': 4, 'width': 76, 'activation': 'gelu', 'n_fourier': 32, 'lr': 0.004708152521770954, 'optimizer': 'adam', 'scheduler': 'cosine', 'batch': 2048, 'center_frac': 0.2300602685067451, 'ff_sigma': 1.2625256466755037}. Best is trial 16 with value: 0.17795267701148987.
[I 2026-07-14 17:21:20,618] Trial 19 pruned. 

best val residual MSE: 1.7795e-01
best eta_fit:          0.69237
best params:           {'sym_mode': 'reynolds', 'depth': 4, 'width': 35, 'activation': 'tanh', 'n_fourier': 32, 'lr': 0.005631868359964832, 'optimizer': 'adam', 'scheduler': 'cosine', 'batch': 4096, 'center_frac': 0.21187960431299013, 'ff_sigma': 1.3355148066365234, 'weight_decay': 0.0}
artifacts:             /Users/georgeliao/Desktop/Digitised Notes/Machine Learning/Deep Learning/SPINN Project/SPINN/spinn/results/hard_bc_tuning/study_summary.json, best_model.pt
